{
  "version": "2.0.0",
  "gua_id": "lesson-01_乾为天",
  "gua_title": "第 01 卦 · 乾为天（䷀）—— 纯阳刚健与六龙驭天全息精研",
  "gua_symbol": "䷀",
  "created_at": "2026-10-27T02:49:39.880Z",
  "updated_at": "10/27/2026, 10:49:39 AM",
  "dialogues": [
    {
      "id": "dlg_1793069379911",
      "timestamp": "10/27/2026, 10:49:39 AM",
      "question": "九三终日乾乾夕惕若厉，在职场如何践行？",
      "answer": "【玄微先生·易道开示】：九三居下卦之极，将进未进之时。白天抓业务交付，夜晚反思复盘，建立SOP防错机制，自然无咎。"
    }
  ],
  "notes": [
    {
      "id": "note_1793069379881",
      "timestamp": "10/27/2026, 10:49:39 AM",
      "title": "初九爻辞心得",
      "content": "潜龙勿用，关键在一个潜字，养精蓄锐而非偷懒。"
    }
  ],
  "review": {
    "q1_mirror": "2023年项目攻坚期过于冒进，导致团队疲惫失和。",
    "q2_mindset": "进退有常，不可孤注一掷。",
    "q3_action": "每天下班前进行10分钟日终惕厉复盘。",
    "updated_at": "10/27/2026, 10:49:39 AM",
    "ai_analysis": {
      "content": "【玄微先生·易道学术四维点评】：\n1. 🧭【时位契合度】：学员精准锁定了九三爻的临界警诫，时位契合甚高；\n2. ⚡【反常识穿透】：点破了“进退有常”的阴阳节律，脱离了单纯比拼刚猛的世俗误区；\n3. 🛡️【知行闭环】：日终惕厉10分钟之微动作极为可行，防微杜渐；\n4. 📜【知行箴言】：终日乾乾与时偕行，知至至之可与几也！",
      "updated_at": "10/27/2026, 10:49:39 AM"
    }
  },
  "feynman": {
    "framework": {
      "core_trend": "纯阳至健，六阳爻递进",
      "key_yao_turn": "九三到九四为跃渊转折",
      "real_case": "创业团队从MVP验证到规模化复制",
      "anti_common_rule": "亢龙有悔，贵而无位高而无民"
    },
    "full_text": "乾卦讲的是一个人或组织从默默无闻（潜龙）到大有作为（飞龙），最终要防止骄傲自满（亢龙）的全生命周期演进规律。",
    "updated_at": "10/27/2026, 10:49:39 AM"
  }
}